{
  "$schema": "http://json-schema.org/draft-04/schema#",
  "$id": "https://raw.githubusercontent.com/umccr/orcabus/main/docs/schemas/events/sequencerunmanager/SequenceRunSampleSheetChange.schema.json",
  "description": "EventBridge custom event schema for orcabus.sequencerunmanager@SequenceRunSampleSheetChange",
  "title": "AWSEvent",
  "definitions": {
    "SequenceRunSampleSheetChange": {
      "type": "object",
      "required": [
        "id",
        "version",
        "instrumentRunId",
        "sequenceRunId",
        "timeStamp",
        "sampleSheetName",
        "apiUrl",
        "checksum",
        "checksumType"
      ],
      "properties": {
        "id": {
          "type": "string"
        },
        "version": {
          "type": "string"
        },
        "instrumentRunId": {
          "type": "string"
        },
        "sequenceRunId": {
          "type": "string"
        },
        "timeStamp": {
          "type": "string",
          "format": "date-time"
        },
        "sampleSheetName": {
          "type": "string"
        },
        "apiUrl": {
          "type": "string"
        },
        "checksum": {
          "type": "string"
        },
        "checksumType": {
          "type": "string"
        },
        "description": {
          "type": ["string", "null"]
        }
      }
    }
  },
  "type": "object",
  "properties": {
    "id": {
      "type": "string"
    },
    "region": {
      "type": "string"
    },
    "resources": {
      "type": "array",
      "items": {
        "type": "string"
      }
    },
    "source": {
      "type": "string"
    },
    "time": {
      "format": "date-time",
      "type": "string"
    },
    "version": {
      "type": "string"
    },
    "account": {
      "type": "string"
    },
    "detail-type": {
      "type": "string"
    },
    "detail": {
      "$ref": "#/definitions/SequenceRunSampleSheetChange"
    }
  },
  "required": ["detail", "detail-type", "source"]
}
