{
  "version": "0",
  "id": "12345678-90ab-cdef-1234-567890abcdef",
  "detail-type": "SequenceRunSampleSheetChange",
  "source": "orcabus.sequencerunmanager",
  "account": "000000000000",
  "time": "2024-04-27T03:45:02.113245Z",
  "region": "ap-southeast-2",
  "resources": [],
  "detail": {
    "id": "91e7bf905efa815dbe081df1644dc495",
    "version": "1.1.0",
    "instrumentRunId": "123456_A7890_1234_ABCDEFGH",
    "sequenceRunId": "r.1234567890abcdefghijklmn",
    "timeStamp": "2024-04-27T03:45:02.113245Z",
    "sampleSheetName": "sampleSheet_v2.csv",
    "apiUrl": "https://sequence.dev.umccr.org/api/v1/sample_sheet/ss.01234567890ABCDEF/",
    "checksum": "1234567890abcdefghijklmnopqrstuvwxyz1234567890abcdefghijklmnopqrstuvwxyz",
    "checksumType": "sha256",
    "description": "description"
  }
}
